{
  "id": "ru.mykids.psychology.week07.boundaries",
  "schemaVersion": 1,
  "version": "1.0.0",
  "title": "Неделя 7. Личные границы: как говорить «нет»",
  "description": "Учимся отстаивать границы без чувства вины через технику «Я-сообщений». Практикум выходного дня: Проигрываем сложные разговоры с друзьями и взрослыми в безопасной обстановке.",
  "subject": "psychology",
  "gradeRange": [
    11,
    13
  ],
  "locale": "ru-RU",
  "author": "UKids Home",
  "license": "CC-BY-NC-4.0",
  "tags": [
    "психология",
    "неделя 7"
  ],
  "reward": {
    "creditsPerCorrect": 2,
    "bonusOnPerfect": 3,
    "dailyCreditCap": 20
  },
  "delivery": {
    "itemsPerSession": 6,
    "selection": "sequential",
    "passThreshold": 0.5,
    "cooldownHoursPerItem": 168
  },
  "items": [
    "items/001.json",
    "items/002.json",
    "items/003.json",
    "items/004.json",
    "items/005.json",
    "items/006.json"
  ]
}
