{
  "id": "ru.mykids.psychology.week11.teamwork",
  "schemaVersion": 1,
  "version": "1.0.0",
  "title": "Неделя 11. Командная работа: роли в проекте",
  "description": "Разбираем роли в команде и то, как распределять ответственность. Практикум выходного дня: Команда собирает концепт финального проекта — социального, творческого или исследовательского.",
  "subject": "psychology",
  "gradeRange": [
    11,
    13
  ],
  "locale": "ru-RU",
  "author": "UKids Home",
  "license": "CC-BY-NC-4.0",
  "tags": [
    "психология",
    "неделя 11"
  ],
  "reward": {
    "creditsPerCorrect": 2,
    "bonusOnPerfect": 3,
    "dailyCreditCap": 20
  },
  "delivery": {
    "itemsPerSession": 6,
    "selection": "sequential",
    "passThreshold": 0.5,
    "cooldownHoursPerItem": 168
  },
  "items": [
    "items/001.json",
    "items/002.json",
    "items/003.json",
    "items/004.json",
    "items/005.json",
    "items/006.json"
  ]
}
