{
  "id": "ru.mykids.psychology.week05.critical-thinking",
  "schemaVersion": 1,
  "version": "1.0.0",
  "title": "Неделя 5. Критическое мышление: факты vs мнения",
  "description": "Учимся отличать факты от мнений и оценочных суждений, замечать манипуляции. Практикум выходного дня: Аргументируем свою точку зрения в мини-дебатах и ищем логические ошибки у оппонента.",
  "subject": "psychology",
  "gradeRange": [
    11,
    13
  ],
  "locale": "ru-RU",
  "author": "UKids Home",
  "license": "CC-BY-NC-4.0",
  "tags": [
    "психология",
    "неделя 5"
  ],
  "reward": {
    "creditsPerCorrect": 2,
    "bonusOnPerfect": 3,
    "dailyCreditCap": 20
  },
  "delivery": {
    "itemsPerSession": 6,
    "selection": "sequential",
    "passThreshold": 0.5,
    "cooldownHoursPerItem": 168
  },
  "items": [
    "items/001.json",
    "items/002.json",
    "items/003.json",
    "items/004.json",
    "items/005.json",
    "items/006.json"
  ]
}
